"ID","Gemeinde_color","Ja_Stimmen_In_Prozent","Nein_Stimmen_In_Prozent","Gemeinde_de","Text_de"
3101,7,7,93,"Appenzell AI","In Appenzell findet die Individualbesteuerung mit 93 Prozent keine Mehrheit. Appenzell verzeichnet im Kanton Appenzell Innerrhoden den höchsten Anteil an Nein-Stimmen zur Individualbesteuerung."
3102,31.2,31.2,68.8,"Gonten AI","68,8 Prozent der Stimmbürgerinnen und Stimmbürger von Gonten haben sich gegen die Individualbesteuerung ausgesprochen. Gonten stimmt, wie der Kanton Appenzell Innerrhoden, gegen die Individualbesteuerung."
3104,90.6,90.6,9.4,"Schlatt-Haslen AI","In Schlatt-Haslen erhält die Individualbesteuerung 90,6 Prozent Zustimmung. Im Kanton Appenzell Innerrhoden liegt die Schlatt-Haslen beim Ja-Anteil zu Abschafffung des Eigenmietwerts an der Spitze."
3111,17.5,17.5,82.5,"Oberegg AI","In Oberegg haben 82,5 Prozent gegen die Individualbesteuerung gestimmt. Oberegg stimmt, wie der Kanton Appenzell Innerrhoden, gegen die Individualbesteuerung."
3112,76.5,76.5,23.5,"Schwende-Rüti AI","76,5 Prozent der Stimmbürgerinnen und Stimmbürger von Schwende-Rüti haben sich für die Individualbesteuerung ausgesprochen. Schwende-Rüti nimmt die Individualbesteuerung an, während der Kanton Appenzell Innerrhoden sie ablehnt."
