"ID","Gemeinde_color","Ja_Stimmen_In_Prozent","Nein_Stimmen_In_Prozent","Gemeinde_de","Text_de"
3101,73.6,73.6,26.4,"Appenzell AI","Appenzell hat sich mit 54,8 Prozent gegen die Bargeldinitiative ausgesprochen. Der Gegenvorschlag des Bundesrat und Parlamentes hingegen wurde mit 73,6 Prozent angenommen."
3102,74,74,26,"Gonten AI","Die Stimmbürgerinnen und Stimmbürger von Gonten stimmten mit 53,8 Prozent für die Bargeldinitiative und mit 74 Prozent für den Gegenvorschlag von Bundesrat und Parlament. In der Stichfrage entschieden sich 53,1 Prozent für den Gegenvorschlag."
3104,76.3,76.3,23.7,"Schlatt-Haslen AI","51 Prozent der Stimmberechtigten in Schlatt-Haslen haben die Bargeldinitiative abgelehnt. Im Gegensatz dazu fand der Gegenvorschlag des Regierungs- und Kantonsrates mit 76,3 Prozent eine Mehrheit."
3111,67.6,67.6,32.4,"Oberegg AI","Die Stimmberechtigten in Oberegg haben die Bargeldinitiative mit 56,9 Prozent angenommen und befürworten auch den Gegenvorschlag von Bundesrat und Parlament mit 67,6 Prozent. Das Resultat der Stichfrage ergab mit 50,6 Prozent den Vorzug für den Gegenvorschlag."
3112,75.6,75.6,24.4,"Schwende-Rüti AI","Schwende-Rüti hat mit 57,2 Prozent Nein gesagt Bargeldinitiative. Der Gegenvorschlag des Regierungs- und Kantonsrates hingegen fand eine Ja-Mehrheit von 75,6 Prozent."
