"ID","Gemeinde_color","Ja_Stimmen_In_Prozent","Nein_Stimmen_In_Prozent","Gemeinde_de","Text_de"
1401,27.9,27.9,72.1,"Alpnach OW","Alpnach hat die SRG-Initiative mit 72,1 Prozent abgelehnt. Damit ist in Alpnach die Ablehnung im Vergleich zur Abstimmung über die No-Billag-Initiative im Jahr 2018 gestiegen. Damals betrug der Nein-Stimmen-Anteil 67,8 Prozent."
1402,37.1,37.1,62.9,"Engelberg OW","In Engelberg hat die Stimmbevölkerung die SRG-Initiative abgelehnt. Das Volksbegehren wurde mit einem Nein-Stimmen-Anteil von 62,9 Prozent verworfen. Damit hat die Ablehung in Engelberg im Vergleich zur Abstimmung über die No-Billag-Initiative im Jahr 2018 abgenommen. Damals betrug der Nein-Stimmen-Anteil noch 65,3 Prozent."
1403,4.7,4.7,95.3,"Giswil OW","In Giswil hat die Stimmbevölkerung die SRG-Initiative abgelehnt. Das Volksbegehren wurde mit einem Nein-Stimmen-Anteil von 95,3 Prozent verworfen. Damit ist in Giswil die Ablehnung im Vergleich zur Abstimmung über die No-Billag-Initiative im Jahr 2018 gestiegen. Damals betrug der Nein-Stimmen-Anteil 69,8 Prozent."
1404,62.4,62.4,37.6,"Kerns OW","62,4 Prozent der Abstimmenden in der Gemeinde Kerns haben Ja gesagt zur SRG-Initiative. Damit hat in Kerns seit der letzten Abstimmung über die Erbschaftssteuer im Jahr 2018 ein Meinungsumschwung stattgefunden: Damals hatte noch eine Mehrheit von 68,1 Prozent ein Nein in die Urne gelegt."
1405,79.7,79.7,20.3,"Lungern OW","79,7 Prozent der Abstimmenden in der Gemeinde Lungern haben Ja gesagt zur SRG-Initiative. Damit hat in Lungern seit der letzten Abstimmung über die Erbschaftssteuer im Jahr 2018 ein Meinungsumschwung stattgefunden: Damals hatte noch eine Mehrheit von 73,3 Prozent ein Nein in die Urne gelegt."
1406,75.1,75.1,24.9,"Sachseln OW","Ja zur SRG-Initiative in Sachseln. Die Gemeinde hat das Volksbegehren mit 75,1 Prozent der Stimmen angenommen. Damit hat in Sachseln seit der letzten Abstimmung über die Erbschaftssteuer im Jahr 2018 ein Meinungsumschwung stattgefunden: Damals hatte noch eine Mehrheit von 72,6 Prozent ein Nein in die Urne gelegt."
1407,91.4,91.4,8.6,"Sarnen OW","Die Gemeinde Sarnen hat die SRG-Initiative mit 91,4 Prozent Ja-Stimmen angenommen. Damit hat in Sarnen seit der letzten Abstimmung über die Erbschaftssteuer im Jahr 2018 ein Meinungsumschwung stattgefunden: Damals hatte noch eine Mehrheit von 68,6 Prozent ein Nein in die Urne gelegt."
