"ID","Gemeinde_color","Ja_Stimmen_In_Prozent","Nein_Stimmen_In_Prozent","Gemeinde_de","Text_de"
2901,44.7,44.7,55.3,"Gächlingen SH","Gächlingen hat sich mit 55,3 Prozent gegen die Bargeldinitiative ausgesprochen. Der Gegenvorschlag des Bundesrat und Parlamentes hingegen wurde mit 71,3 Prozent angenommen."
2903,65.3,65.3,34.7,"Löhningen SH","Die Stimmberechtigten in Löhningen haben die Bargeldinitiative mit 65,3 Prozent angenommen und befürworten auch den Gegenvorschlag des Bundesrat und Parlaments mit 91,9 Prozent. Bei der Stichfrage gaben sie mit 73 Prozent der Initiative den Vorzug."
2904,90.8,90.8,9.2,"Neunkirch SH","Die Bargeldinitiative ist in Neunkirch mit 90,8 Prozent der Stimmen angenommen worden. Der Gegenvorschlag von Bundesrat und Parlament hingegen wurde mit 61,5 Prozent abgelehnt."
2914,56.9,56.9,43.1,"Büttenhardt SH","Die Gemeinde Büttenhardt hat die Bargeldinitiative mit 56,9 Prozent und den Gegenvorschlag von Bundesrat und Parlament mit 52 Prozent angenommen. Bei der Stichfrage sprachen sich die Stimmberechtigten mit 59,1 Prozent für den Gegenvorschlag aus."
2915,28.3,28.3,71.7,"Dörflingen SH","Weder die Bargeldinitiative (71,7 Prozent Nein) noch der Gegenvorschlag des Bundesrat und Parlaments (81,5 Prozent Nein) haben in Dörflingen eine Mehrheit gefunden."
2917,40.1,40.1,59.9,"Lohn SH","Lohn SH hat sich mit 59,9 Prozent gegen die Bargeldinitiative ausgesprochen. Der Gegenvorschlag des Bundesrat und Parlamentes hingegen wurde mit 65,4 Prozent angenommen."
2919,25.2,25.2,74.8,"Stetten SH","Die Bargeldinitiative hat in Stetten SH 74,8 Prozent Gegenstimmen erhalten. Der Gegenvorschlag des Regierungs- und Kantonsrates wurde hingegen von 52,1 Prozent angenommen."
2920,65.3,65.3,34.7,"Thayngen SH","Thayngen hat mit 65,3 Prozent Ja gesagt zur Bargeldinitiative. Den Gegenvorschlag von Bundesrat und Parlament lehnte eine Mehrheit von 71 Prozent ab."
2931,60.5,60.5,39.5,"Bargen SH","Die Stimmberechtigten in Bargen SH haben die Bargeldinitiative mit 60,5 Prozent angenommen und befürworten auch den Gegenvorschlag des Bundesrat und Parlaments mit 95,9 Prozent. Bei der Stichfrage gaben sie mit 60,4 Prozent der Initiative den Vorzug."
2932,55.7,55.7,44.3,"Beringen SH","Die Gemeinde Beringen hat die Bargeldinitiative mit 55,7 Prozent angenommen. Der Gegenvorschlag von Bundesrat und Parlament hingegen wurde mit 54,3 Prozent abgelehnt."
2933,96.6,96.6,3.4,"Buchberg SH","Die Stimmberechtigten in Buchberg haben die Bargeldinitiative mit 96,6 Prozent an angenommen und befürworten auch den Gegenvorschlag von Bundesrat und Parlament mit \66,7 Prozent. Das Resultat der Stichfrage ergab mit 52,8 Prozent den Vorzug für den Gegenvorschlag."
2936,17,17,83,"Merishausen SH","83 Prozent der Abstimmenden in Merishausen haben sich gegen die Bargeldinitiative ausgesprochen. Der Gegenvorschlag des Regierungs- und Kantonsrates hingegen erhielt eine Zustimmung von 64,2 Prozent."
2937,54.9,54.9,45.1,"Neuhausen am Rheinfall SH","Die Gemeinde Neuhausen am Rheinfall hat die Bargeldinitiative mit 54,9 Prozent angenommen. Der Gegenvorschlag von Bundesrat und Parlament hingegen wurde mit 61,8 Prozent abgelehnt."
2938,53.3,53.3,46.7,"Rüdlingen SH","Rüdlingen hat die Initiative Bargeldinitiative mit 53,3 Prozent und den Gegenvorschlag von Bundesrat und Parlaments mit 70,8 Prozent angenommen. Bei der Stichfrage haben sich die Stimmberechtigten mit 87,1 Prozent für die Initiative ausgesprochen."
2939,75.7,75.7,24.3,"Schaffhausen SH","Schaffhausen hat die Initiative Bargeldinitiative mit 75,7 Prozent und den Gegenvorschlag von Bundesrat und Parlaments mit 76,5 Prozent angenommen. Bei der Stichfrage haben sich die Stimmberechtigten mit 59,6 Prozent für die Initiative ausgesprochen."
2951,95.4,95.4,4.6,"Beggingen SH","In Beggingen hat die Stimmbevölkerung der Bargeldinitiative mit 95,4 Prozent zugestimmt. Eine Mehrheit von 51,4 Prozent lehnte den Gegenvorschlag von Bundesrat und Parlament ab."
2952,29.9,29.9,70.1,"Schleitheim SH","In Schleitheim hat weder die Bargeldinitiative (70,1 Prozent Nein) noch der Gegenvorschlag von Bundesrat und Parlament (61,3 Prozent Nein) eine Mehrheit erzielt."
2953,43.2,43.2,56.8,"Siblingen SH","Sowohl die Bargeldinitiative mit 56,8 Prozent Nein-Stimmen als auch der Gegenvorschlag des Bundesrat und Parlaments mit 56,6 Prozent Nein-Stimmen haben in Siblingen die Mehrheit verfehlt."
2961,15.8,15.8,84.2,"Buch SH","84,2 Prozent der Abstimmenden in Buch SH haben sich gegen die Bargeldinitiative ausgesprochen. Der Gegenvorschlag des Regierungs- und Kantonsrates hingegen erhielt eine Zustimmung von 50,6 Prozent."
2962,66.4,66.4,33.6,"Hemishofen SH","Die Bargeldinitiative hat in Hemishofen mit 66,4 Prozent Zustimmung gefunden. Der Gegenvorschlag von Bundesrat und Parlament wurde mit 69 Prozent mehrheitlich abgelehnt."
2963,39,39,61,"Ramsen SH","Sowohl die Bargeldinitiative mit 61 Prozent Nein-Stimmen als auch der Gegenvorschlag des Bundesrat und Parlaments mit 78,4 Prozent Nein-Stimmen haben in Ramsen die Mehrheit verfehlt."
2964,6.6,6.6,93.4,"Stein am Rhein SH","93,4 Prozent der Abstimmenden in Stein am Rhein haben sich gegen die Bargeldinitiative ausgesprochen. Der Gegenvorschlag des Regierungs- und Kantonsrates hingegen erhielt eine Zustimmung von 77,6 Prozent."
2971,33.5,33.5,66.5,"Hallau SH","In Hallau hat weder die Bargeldinitiative (66,5 Prozent Nein) noch der Gegenvorschlag von Bundesrat und Parlament (72,3 Prozent Nein) eine Mehrheit erzielt."
2972,51.1,51.1,48.9,"Oberhallau SH","Die Gemeinde Oberhallau hat die Bargeldinitiative mit 51,1 Prozent angenommen. Der Gegenvorschlag von Bundesrat und Parlament hingegen wurde mit 74,9 Prozent abgelehnt."
2973,77,77,23,"Trasadingen SH","Die Stimmberechtigten in Trasadingen haben die Bargeldinitiative mit 77 Prozent angenommen und befürworten auch den Gegenvorschlag des Bundesrat und Parlaments mit 57 Prozent. Bei der Stichfrage gaben sie mit 65,9 Prozent der Initiative den Vorzug."
2974,56,56,44,"Wilchingen SH","56 Prozent der Stimmbürgerinnen und Stimmbürger von Wilchingen haben sich für die Bargeldinitiative und 78,2 Prozent für den Gegenvorschlag von Bundesrat und Parlament ausgesprochen. Bei der Stichfrage gaben 83,4 Prozent der Initiative den Vorrang."
